{
  "tool": "Sentinel Virus Scanner",
  "manifest_type": "rust-demo-evidence",
  "generated_at": "2026-04-29T15:32:07Z",
  "inputs": {
    "target": {
      "path": "demo/demo-tree",
      "kind": "directory"
    },
    "signature_database": {
      "path": "signatures/malware-signatures.json",
      "sha256": "52b9e887c48fb223db3736e2aba7485868baccc881535b1f886ed1ada2914a3c",
      "size_bytes": 960
    }
  },
  "demo_tree": [
    {
      "path": "clean/image-placeholder.bin",
      "sha256": "2d878a97c4fb1d6cabcf0b6e6aa52eb01ec6a7bf064de55b5d4c893e27673bbe",
      "size_bytes": 56
    },
    {
      "path": "clean/notes.txt",
      "sha256": "e74722e0fe162678153f68b7ebca5d363a5175f7dc317c1cff65208ad912ff4c",
      "size_bytes": 105
    },
    {
      "path": "ignored-or-empty/empty.txt",
      "sha256": "01ba4719c80b6fe911b091a7c05124b64eeece964e09c058ef8f9805daca546b",
      "size_bytes": 1
    },
    {
      "path": "nested/level-1/level-2/eicar.com.txt",
      "sha256": "275a021bbfb6489e54d471899f7db9d1663fc695ec2fe2a2c4538aabf651fd0f",
      "size_bytes": 68
    },
    {
      "path": "suspicious/api-names-fixture.txt",
      "sha256": "e82d86354c2d35e16ba25417d042a6d8633fe390118bcfa0767f7370352b3f2e",
      "size_bytes": 149
    }
  ],
  "reports": [
    {
      "path": "reports/demo-report.json",
      "sha256": "f9926cd31a25d574857c099d95e4941410048faaabcd33280ac9ac9bf3e69faa",
      "size_bytes": 5292,
      "tool": "Sentinel Virus Scanner",
      "target": "../demo/demo-tree",
      "summary": {
        "clean": 3,
        "error": 0,
        "files_scanned": 5,
        "infected": 1,
        "skipped": 0,
        "suspicious": 1,
        "total_results": 5
      },
      "scan_metadata": {
        "automaton_states": 69,
        "chunk_size_bytes": 1048576,
        "hash_filter": "bloom-filter",
        "hash_filter_bits": 128,
        "hash_filter_hash_functions": 3,
        "hash_filter_items": 2,
        "hash_filter_policy": "precheck-then-exact-hash-map",
        "heuristic_engine": "bounded-static-byte-sample",
        "heuristic_rules": [
          "api-name-indicator",
          "magic-mismatch",
          "high-entropy-sample"
        ],
        "heuristic_sample_limit_bytes": 1048576,
        "pattern_count": 1,
        "pattern_engine": "aho-corasick-byte-automaton",
        "symlink_policy": "skip",
        "traversal_policy": "deterministic-rglob-files"
      }
    },
    {
      "path": "reports/demo-report.md",
      "sha256": "0af7b6051c18894f84e8c3a86fba5f49e0a3358cd998e825bb2546d61b0b069a",
      "size_bytes": 1991
    }
  ],
  "reproducibility": {
    "format_command": "cargo fmt --check",
    "test_command": "cargo test",
    "lint_command": "cargo clippy --all-targets -- -D warnings",
    "signature_validation_command": "cargo run -- validate-signatures --signatures ../signatures/malware-signatures.json",
    "eicar_preparation_command": "cargo run -- prepare-eicar-demo --target ../demo/demo-tree",
    "demo_verification_command": "cargo run -- verify-demo --target ../demo/demo-tree --signatures ../signatures/malware-signatures.json",
    "scan_command": "cargo run -- scan --target ../demo/demo-tree --signatures ../signatures/malware-signatures.json --json ../reports/demo-report.json --markdown ../reports/demo-report.md",
    "evidence_manifest_command": "cargo run -- write-evidence --target ../demo/demo-tree --signatures ../signatures/malware-signatures.json --report ../reports/demo-report.json --report ../reports/demo-report.md --output ../reports/demo-evidence-manifest.json"
  },
  "safety": {
    "read_only_scanner": true,
    "uses_live_malware": false,
    "executes_scanned_files": false,
    "mutates_scanned_files": false,
    "network_actions": false,
    "fixture_note": "Current Rust demo uses the official EICAR safe anti-malware test file generated by the Rust prepare-eicar-demo command; no live malware is used."
  }
}
